{
  "schema_version": "h668-run-v1",
  "result_type": "checkpoint",
  "method_family": "other",
  "search_scope": "",
  "coverage_kind": "heuristic",
  "seed_derivation": null,
  "seeds": [],
  "evaluations": null,
  "wall_seconds": null,
  "hardware_summary": null,
  "model_summary": null,
  "code_url": null,
  "code_commit": null,
  "parent_candidate_sha256": null,
  "candidate_sha256": "0000000000000000000000000000000000000000000000000000000000000000",
  "metrics": {
    "off_diagonal_energy": null,
    "orthogonal_row_pairs": null,
    "max_absolute_off_diagonal": null
  },
  "publication_consent": true
}